,date,text,user
2470,2018-07-02 17:30:01+00:00,the division and in fighting in the tory cabinet over brexit threatens jobs and our communities ,jeremycorbyn
2507,2018-06-26 21:24:39+00:00,it was good to meet greeces prime minister alexis tsipras today to talk about brexit the fight against austerity and the crucial importance of international solidarity in our time governments can and must work together to support refugees fleeing war and devastation ,jeremycorbyn
2583,2018-06-13 12:00:49+00:00,when will realise it is more important to secure a good brexit deal than to appease the competing egos of her warring cabinet ,jeremycorbyn
2603,2018-06-09 16:20:15+00:00,the government promised a detailed ambitious and precise brexit white paper this month setting out their negotiating priorities once again it s been postponed the tories are botching brexit and risking jobs and our economy in the process ,jeremycorbyn
2626,2018-06-06 12:07:03+00:00,when it comes to brexit this government has delivered more delays and more cancellations than northern rail ,jeremycorbyn
2666,2018-05-26 08:00:00+00:00,yesterday i visited the border between northern ireland and the republic the tories reckless approach to brexit risks dividing communities labour will negotiate a new customs union to prevent a hard border to secure peace and prosperity ,jeremycorbyn
2704,2018-05-16 13:19:59+00:00,the government is in complete disarray on brexit and its reckless approach is putting jobs at risk if cant negotiate a good deal she should step aside so that labour can ,jeremycorbyn
2828,2018-04-16 14:14:31+00:00,this morning i met nana akufo addo president of ghana ahead of commonwealth heads of government meetings we discussed the rights of commonwealth citizens in the uk trade after brexit reform of the commonwealth and un the role of the african union and us forces in africa ,jeremycorbyn
2959,2018-02-28 13:42:39+00:00,the government is so divided the prime minister is incapable of delivering a coherent and decisive plan for brexit ,jeremycorbyn
2960,2018-02-27 16:17:08+00:00,great to meet zoran zaev prime minister of macedonia in my office yesterday we discussed brexit security and social justice ,jeremycorbyn
2961,2018-02-26 17:05:08+00:00,labour is the party of the new common sense on the economy on public services and on brexit ,jeremycorbyn
2976,2018-02-21 13:58:11+00:00,the tories speeches on their negotiating position for brexit have been filled with waffle and empty rhetoric ,jeremycorbyn
3149,2017-12-18 18:23:53+00:00,the want to use brexit to rip up rights at work and make britain a tax haven for the super rich ,jeremycorbyn
3175,2017-12-11 17:59:03+00:00,today in parliament the prime minister failed to explain exactly what she has agreed in phase one of the brexit negotiations ,jeremycorbyn
3185,2017-12-08 16:09:01+00:00,following last years eu referendum britain is at a crossroads where we have to rethink our role in the world labour rejects those who want to use brexit to turn britain in on itself and exacerbate our current economic system s insecurities and inequalities ,jeremycorbyn
3193,2017-12-06 13:55:24+00:00,brexit talks in chaos pay falling and more people in poverty wouldnt it be better if the just got out of the way ,jeremycorbyn
3199,2017-12-04 19:43:15+00:00,the reason for today s failure in the brexit talks is the grubby deal the tories did with the dup after the election each passing day provides further evidence that s government is completely ill equipped to negotiate a successful deal for our country ,jeremycorbyn
3239,2017-11-22 13:16:19+00:00,tories say one thing on brexit then do the opposite they have no plan no strategy and no energy to achieve a good deal for britain ,jeremycorbyn
3317,2017-11-06 14:23:31+00:00,its labour that has common ground with businesses on putting needs of the economy front centre stage in our brexit negotiations ,jeremycorbyn
3318,2017-11-06 14:11:44+00:00,businesses and labour have common ground on the need for brexit transitional arrangements to be agreed immediately ,jeremycorbyn
3319,2017-11-06 14:00:15+00:00,businesses see the tories stuck in chaos and confusion over brexit the situation is more uncertain and more precarious than ever ,jeremycorbyn
3320,2017-11-06 13:49:21+00:00,labour offers common ground with businesses on brexit investment training and an industrial strategy ,jeremycorbyn
3370,2017-10-23 16:29:00+00:00,only labour will deliver a brexit that puts jobs and our economy first ,jeremycorbyn
3376,2017-10-20 11:43:52+00:00,it is imperative we get the brexit negotiations back on track to end the uncertainty to industries jobs and peoples lives ,jeremycorbyn
3378,2017-10-19 17:07:53+00:00,i was in brussels today meeting and promoting a jobs first brexit that protects trade and living standards ,jeremycorbyn
3381,2017-10-19 15:20:20+00:00,im in brussels today to meet european leaders to promote the interests of the british people in the brexit negotiations ,jeremycorbyn
3401,2017-10-14 11:05:10+00:00,the tories chaotic version of brexit would turn our country into a deregulated tax haven labour will put jobs our economy first ,jeremycorbyn
3415,2017-10-10 18:53:48+00:00,unacceptable the tories chaotic handling of brexit means no deal is a real risk must guarantee eu migrants rights now ,jeremycorbyn
3418,2017-10-09 19:49:32+00:00,at the moment when britain needs a strong brexit negotiating team the are negotiating who will be their next leader ,jeremycorbyn
3456,2017-09-30 14:40:23+00:00,unlike the tories labours brexit will work for the many not the few ,jeremycorbyn
3529,2017-09-22 18:04:40+00:00,after s and months since the eu referendum the tories are still no clearer about their plan for brexit ,jeremycorbyn
3554,2017-09-12 15:44:01+00:00,labour wants a jobs first brexit where work pays employees have security and decent conditions and prosperity is shared ,jeremycorbyn
3762,2017-07-13 16:34:44+00:00,today i met michel barnier to discuss a jobs first brexit in contrast to the race to the bottom tax haven threatened by the ,jeremycorbyn
3763,2017-07-13 10:40:46+00:00,today i am in brussels to meet michel barnier and set out labours priorities for a jobs first brexit ,jeremycorbyn
3765,2017-07-12 13:24:11+00:00, highlights tories brexit chaos government has run out of ideas ministers divided amp making it up as they go along ,jeremycorbyn
3849,2017-06-26 16:10:47+00:00, has no mandate at home and no mandate abroad she is unable to negotiate brexit labour would deliver a brexit ,jeremycorbyn
3889,2017-06-18 10:35:06+00:00,on i explained labours priorities for brexit and how our investment led economy will deliver social justice in britain ,jeremycorbyn
3890,2017-06-18 08:23:47+00:00,ahead of my interview on itvs show at am i have written in the mirror about and brexit ,jeremycorbyn
3891,2017-06-17 19:08:04+00:00,change is coming labour will deliver a brexit for the many not the few and bring our country together ,jeremycorbyn
3916,2017-06-11 06:30:01+00:00,the labour party will protect our economy and jobs during brexit so it works for the many not the few ,jeremycorbyn
4051,2017-06-01 15:15:01+00:00,a brexit means a deal that allows us to become a country that values and protects our public services amp invests in our communities,jeremycorbyn
4052,2017-06-01 15:00:04+00:00,a brexit will strengthen workers rights and regulate employers to end undercutting of wages and exploitation of migrant workers ,jeremycorbyn
4053,2017-06-01 14:42:10+00:00,a brexit means a deal that will allow us to upgrade our economy through investment in jobs industry infrastructure and skills ,jeremycorbyn
4054,2017-06-01 13:45:35+00:00,ahead of my speech about how will ensure brexit works watch our broadcast ,jeremycorbyn
4340,2017-05-07 19:16:31+00:00,labours standing up to elites who are determined to hijack brexit so they can pay even less tax and take more of the wealth you create,jeremycorbyn
4386,2017-05-01 18:30:00+00:00,labour will ensure we achieve a brexit deal that protects jobs living standards workers rights and environmental protections ,jeremycorbyn
4387,2017-05-01 18:00:02+00:00,it is clearer by the day that a reckless tory brexit poses a severe risk to the british economy and to people s jobs and living standards ,jeremycorbyn
4422,2017-04-25 07:14:46+00:00,a labour government will offer the british people a fair approach to brexit which puts jobs and the economy first,jeremycorbyn
4445,2017-04-23 18:25:02+00:00,in our brexit negotiations we must secure tariff free access to the single market ,jeremycorbyn
4447,2017-04-23 17:25:49+00:00,labour will protect jobs during brexit we will invest in new industries and infrastructure to create high skill high wage jobs ,jeremycorbyn
4490,2017-04-20 15:30:01+00:00,only labour will focus on what kind of country we want after brexit well unlock opportunities for everyone in this country ,jeremycorbyn
4493,2017-04-20 14:45:00+00:00,theresa may will say that is about brexit while ignoring tory failure amp the issues that affect people s lives every day ,jeremycorbyn
4540,2017-04-13 10:56:07+00:00,while tories seem intent on using brexit to turn us into a low wage tax haven labour will use every power possible to upgrade our economy ,jeremycorbyn
4541,2017-04-13 10:55:47+00:00,while brexit presents many challenges it can give us more powers to encourage best practices support businesses and industries in britain,jeremycorbyn
4634,2017-03-29 20:24:39+00:00,we must have a brexit deal which puts investment and jobs first not tory corporation tax cuts ,jeremycorbyn
4635,2017-03-29 16:30:50+00:00,the direction tories are taking us in the brexit negotiations is reckless and damaging my full response ,jeremycorbyn
4699,2017-03-13 20:43:11+00:00,labour at every stage will challenge govt plans for a bargain basement brexit with our alternative that puts jobs living standards first,jeremycorbyn
4701,2017-03-13 20:42:42+00:00,deeply disappointing that govt denied the people through parliament brexit oversight refused to guarantee the rights of eu nationals,jeremycorbyn
4733,2017-03-07 19:17:34+00:00,theresa may tried to keep the british people out of our brexit negotiations thats wrong we must have a real say through parliament ,jeremycorbyn
4802,2017-02-25 08:30:02+00:00,tories wrap brexit up in fake patriotic posturing waving the union jack while preparing to sell out public services consumer protections,jeremycorbyn
4810,2017-02-24 15:00:04+00:00,theresa may isnt even hiding her brexit threat ,jeremycorbyn
4812,2017-02-24 14:40:01+00:00,rt if you agree that the tories have wrapped brexit up in fake patriotic posturing ,jeremycorbyn
4832,2017-02-20 19:39:28+00:00,i went to the lobby today to show my and labours support for rights of eu citizens living in the uk to stay after brexit ,jeremycorbyn
4848,2017-02-14 08:41:11+00:00,a hunger games approach to brexit,jeremycorbyn
4860,2017-02-08 21:08:35+00:00,real fight starts now over next two years labour will use every opportunity to ensure brexit protects jobs living standards the economy ,jeremycorbyn
4870,2017-02-06 18:29:25+00:00, must guarantee the rights of eu citizens living in uk this isnt about brexit its about basic decency ,jeremycorbyn
4901,2017-01-27 19:37:56+00:00,theresa may failed to challenge trump stand up for our values today she prefers a us corporate trade deal for a bargain basement brexit,jeremycorbyn
4908,2017-01-26 19:43:16+00:00,labour will ensure the british people have genuine say over brexit negotiations because no one voted to give a free hand ,jeremycorbyn
4910,2017-01-26 19:42:25+00:00,labour will amend article bill to prevent the tories using brexit to turn britain into a bargain basement tax haven off coast of europe ,jeremycorbyn
4922,2017-01-24 10:17:51+00:00,labour will seek to amend the article bill to prevent the conservatives using brexit to turn britain into a bargain basement tax haven ,jeremycorbyn
4941,2017-01-18 13:25:47+00:00,at i urged to stop her threat of a bargain basement brexit a low pay tax haven on the shores of europe ,jeremycorbyn
4946,2017-01-18 07:00:06+00:00,we cannot let use brexit to turn britain into a tax haven on the edge of europe and create a bargain basement economy ,jeremycorbyn
4951,2017-01-17 14:11:43+00:00, has made clear that she is determined to use brexit to turn britain into a bargain basement tax haven on the shores of europe ,jeremycorbyn
4957,2017-01-16 09:57:36+00:00,my full interview where we discussed everything from tories chaotic brexit to their failure on ,jeremycorbyn
4960,2017-01-15 13:43:55+00:00,on this morning we discussed s chaotic brexit the amp how labour will build a more equal society ,jeremycorbyn
4981,2017-01-12 11:28:53+00:00,the british people voted to refinance the nhs its labour who will deliver it my brexit speech from tuesday ,jeremycorbyn
4982,2017-01-12 08:00:04+00:00,labour accepts the challenges voters gave and will insist on a brexit that works not just for city interests but in the interests of us all ,jeremycorbyn
4996,2017-01-10 16:55:01+00:00,a labour brexit would take back control of our jobs market to ensure every worker has a secure job with secure pay ,jeremycorbyn
5001,2017-01-10 16:04:18+00:00,unlike the tories labour will push for a brexit thats in the interests of the whole country not just bankers in london,jeremycorbyn
5002,2017-01-10 08:48:13+00:00,labours offering an economic alternative and challenging a tory brexit that will leave us as bargain basement britain on the edge of europe,jeremycorbyn
5081,2016-12-07 13:22:28+00:00,emily thornberry questioned the conservatives at prime minister s questions today over their chaotic brexit ,jeremycorbyn
5088,2016-12-03 11:21:30+00:00,discussing working together to get best for uk eu from brexit negotiations with czech foreign minister ,jeremycorbyn
5090,2016-12-02 19:12:47+00:00,great to be welcomed by to where i will discuss brexit amp beating the populist far right ,jeremycorbyn
5129,2016-11-21 18:15:01+00:00,there can be few bigger potential disruptions to the future growth and prosperity of the uk than a mishandled and chaotic brexit ,jeremycorbyn
5143,2016-11-17 12:28:03+00:00,lets fact check theresa mays answers on international aid the nhs the economy and brexit at yesterdays ,jeremycorbyn
5146,2016-11-16 16:58:26+00:00,watch my full exchange with today she clearly has no plan and is presiding over a chaotic brexit,jeremycorbyn
5148,2016-11-16 12:57:21+00:00,i asked pm what her brexit plan is she didnt give the answers we need to ensure it works for jobs living standards the economy ,jeremycorbyn
5153,2016-11-15 12:08:13+00:00,a leaked memo suggests tories have no plan for brexit as says we need certainty stability amp plan to put jobs amp economy first,jeremycorbyn
5196,2016-11-07 17:05:22+00:00,labour will be pressing for a brexit that works for britain putting jobs living standards and the economy first ,jeremycorbyn
5197,2016-11-07 13:42:38+00:00,transparency needed in pms brexit plans writes we must put jobs living standards and economy first,jeremycorbyn
5200,2016-11-06 12:01:50+00:00,there must be transparency and accountability on brexit terms we wont block article but will fight for a brexit that works for britain,jeremycorbyn
5203,2016-11-05 11:08:23+00:00,at i said labour will press for a brexit that puts jobs living standards and the economy first ,jeremycorbyn
5231,2016-10-27 07:02:04+00:00,the govt has failed to provide clarity on brexit negotiations labour is demanding a clear plan for brexit that delivers for everyone ,jeremycorbyn
5237,2016-10-26 12:33:17+00:00,the tories offer a chaotic brexit is demanding the best deal for the uk putting jobs living standards and economy first ,jeremycorbyn
5238,2016-10-24 16:15:15+00:00,the governments overseeing a chaotic brexit britain needs a plan labour would put jobs living standards and the economy first ,jeremycorbyn
5256,2016-10-20 17:27:29+00:00,divided tory brexit team have no idea what they want or how to get it well campaign for the best deal for britain ,jeremycorbyn
5257,2016-10-20 14:29:20+00:00, has called on david davis to publish the government s timetable for setting out its brexit plans,jeremycorbyn
5258,2016-10-20 14:24:44+00:00,i had an excellent and timely conversation on cooperation on the refugee crisis and brexit with social democratic czech pm ,jeremycorbyn
5259,2016-10-20 11:51:14+00:00,while tory brexit team is in chaos ive had a great discussion with president on european sister party engagement,jeremycorbyn
5261,2016-10-20 10:15:41+00:00,meeting with labour meps in brussels today labour will work to protect jobs and workers rights from a chaotic tory brexit,jeremycorbyn
5278,2016-10-13 08:54:38+00:00,thank you to labours brexit team whose excellent work is exposing the tories brexit plans for what they are a shambles,jeremycorbyn
5279,2016-10-12 15:53:54+00:00,the tories offer no plan no clarity no transparency and no chance of scrutiny of the process for developing a strategy for brexit ,jeremycorbyn
5689,2016-08-07 12:23:05+00:00,sunday mirror readers asked me tonnes of questions about labour brexit and even the politics of my cat el gato ,jeremycorbyn
6009,2016-06-14 17:58:57+00:00,the risk to our nhs from a tory brexit is further austerity cuts to our public services ,jeremycorbyn
6055,2016-06-07 08:34:02+00:00,me amp launched our advert about workers rights at risk of tory negotiated brexit,jeremycorbyn
6068,2016-06-05 12:02:03+00:00,the tories would use brexit to scrap workers rights but which ones would they scrap demand answers with ,jeremycorbyn
6069,2016-06-04 22:03:03+00:00,there will be a bonfire of workers rights if we have a tory negotiated brexit but what rights would they scrap ,jeremycorbyn
6075,2016-06-03 17:01:06+00:00,which workplace rights would the leave campaign scrap if we brexit sign our petition and demand answers now ,jeremycorbyn
6099,2016-05-24 14:10:16+00:00, brexit would jeopardise the rights of working women explains liz snape tuc president in ,jeremycorbyn
