,date,text,user
32,2020-01-31 15:33:05+00:00,the choice of which path we take for a post brexit britain now lies before us ,jeremycorbyn
228,2019-12-09 12:32:41+00:00,the conservative slogan get brexit done is a fraud on the british people johnson s deal will be just the beginning of years more painful negotiations labour will get brexit sorted in six months because we won t be ripping up our main trading relationship ,jeremycorbyn
279,2019-12-06 12:41:07+00:00,if some accuse me of talking to both sides in the brexit debate then so be it i m proud of it why would i only want to talk to half the country i don t want to live in half a country a prime minister must talk and listen to everyone and bring our divided country together ,jeremycorbyn
280,2019-12-06 11:45:29+00:00,this leaked government document shows boris johnson hasnt been telling the truth to the people of our country about his damaging brexit deal his deal will cause huge price rises economic damage to northern ireland scotland and wales and place a border down the irish sea,jeremycorbyn
470,2019-11-22 20:06:21+00:00,i understand his frustration we have to get brexit sorted this is how ,jeremycorbyn
471,2019-11-22 20:05:17+00:00,as prime minister i will be an honest broker and not campaign for either side in the final say referendum we will negotiate a good deal put that to the people alongside remain and then implement your decision we must bring the country together and get beyond brexit ,jeremycorbyn
486,2019-11-21 12:33:19+00:00,we can end privatisation and rescue our nhs we can get brexit sorted and bring our country together we can tackle the climate crisis that threatens us all and we can rewrite the rules of our economy to work for the many not the few the future is ours to make ,jeremycorbyn
498,2019-11-19 22:10:51+00:00,this is a once in a generation election to give the nhs the funding it needs give the people the final say on brexit tackle the climate crisis and invest in good jobs in every corner of britain i ask that you vote for hope and vote for labour on th december ,jeremycorbyn
606,2019-11-09 21:25:37+00:00,you cant trust boris johnson on brexit or anything else ,jeremycorbyn
643,2019-11-06 08:00:12+00:00,we will reduce nhs waiting times get brexit sorted in six months kick start a green industrial revolution build a million genuinely affordable homes within years we will end in work poverty food bank use rough sleeping tuition fees,jeremycorbyn
646,2019-11-05 20:31:05+00:00,labour will get brexit sorted within six months by giving you the final say ,jeremycorbyn
650,2019-11-05 12:04:45+00:00,secure a credible deal in three months put it to the people for the final say with the option to remain in six months that s our brexit policy ,jeremycorbyn
653,2019-11-05 07:01:00+00:00,the conservatives wont win support for their plans if they call it what it is thatcherism on steroids so they re trying to do it under the banner of brexit instead ,jeremycorbyn
701,2019-10-31 08:38:26+00:00,boris johnson has spent months promising wed leave the eu today the failure to do so is his and his alone labour will get brexit sorted by giving the people the final say within six months with the choice of a credible leave deal or remain and well carry out what you decide ,jeremycorbyn
702,2019-10-31 07:58:00+00:00,boris johnson s toxic brexit trade deal with donald trump could hand million a week of nhs money to big drugs corporations we will stop them the nhs is ours and it s not up for grabs ,jeremycorbyn
722,2019-10-28 21:04:23+00:00,this confirms what we know would happen with a johnson trump trade deal the tories would put our nhs at the mercy of us pharmaceutical tech and private healthcare companies we will stop a no deal brexit and johnsons sell out brexit deal ,jeremycorbyn
740,2019-10-26 09:11:20+00:00,this confirms our worst fears boris johnson s sell out brexit is a blueprint for a deregulated economy where vital rights and protections are torn up he has no intention of upholding our high standards after we leave the eu you can t trust a word boris johnson says ,jeremycorbyn
771,2019-10-19 14:48:08+00:00,boris johnsons deal has been defeated he must now obey the law there cannot be a no deal crash out from the european union and we must give the people the final say on brexit ,jeremycorbyn
773,2019-10-19 12:09:19+00:00,we will vote today to stop boris johnson forcing through a no deal brexit or a blackmail vote on his sell out deal ,jeremycorbyn
777,2019-10-18 21:35:44+00:00,the labour movement stands united in opposing boris johnsons sell out brexit deal this deal is a blatant attempt to dismantle our hard won workers rights consumer protections and environmental standards tomorrow well come together to reject it ,jeremycorbyn
841,2019-10-06 08:04:29+00:00,the only people who won t suffer from boris johnsons brexit plans are his super rich donors currently betting against the pound ,jeremycorbyn
918,2019-09-21 11:52:49+00:00,were in brighton for labour party conference today well be setting out our plans to end the brexit crisis kicktart a green industrial revolution and put wealth and power in the hands of the many not the few follow all of the speeches here ,jeremycorbyn
938,2019-09-17 18:39:32+00:00,labour will stop a no deal brexit deliver a public vote and put power back into the hands of the people my article in the ,jeremycorbyn
962,2019-09-11 20:33:48+00:00,official government documents confirm boris johnson is prepared to punish those who can least afford it with a no deal brexit to benefit his wealthy friends he must be stopped ,jeremycorbyn
971,2019-09-10 08:00:40+00:00,a no deal brexit wouldn t affect boris johnson and his wealthy friends its not their livelihoods on the line ,jeremycorbyn
994,2019-09-03 13:52:34+00:00,today i met again with opposition parties as labour works across parliament to prevent a disastrous no deal brexit ,jeremycorbyn
1001,2019-09-02 09:36:23+00:00,boris johnsons plans to shut down parliament to force through a no deal brexit is an attack on our democracy we are doing everything possible to pull the country back from the brink ,jeremycorbyn
1002,2019-09-01 13:48:33+00:00,any move to ignore an act of parliament would be a full blown attack on our constitution were doing everything possible to prevent the disaster of a no deal brexit johnson s attempts to undermine parliamentary sovereignty are shameful and will be fought every step of the way ,jeremycorbyn
1014,2019-08-28 11:18:07+00:00,boris johnson s attempt to suspend parliament to avoid scrutiny of his plans for a reckless no deal brexit is an outrage and a threat to our democracy labour will work across parliament to hold the government to account and prevent a disastrous no deal ,jeremycorbyn
1018,2019-08-27 16:30:48+00:00,we must find common ground and a practical way to stop this disastrous no deal brexit ,jeremycorbyn
1019,2019-08-27 08:25:21+00:00,a no deal brexit is really a trump deal brexit it will put us at the mercy of the big us corporations desperate to get their teeth into our nhs sound the death knell for our steel industry and strip back our food standards and animal welfare protections ,jeremycorbyn
1020,2019-08-26 21:26:53+00:00,i will do everything i can to stop a no deal bankers brexit ,jeremycorbyn
1025,2019-08-24 18:14:11+00:00,small business owners like chloe are fed up with the governments chaotic approach to brexit ,jeremycorbyn
1030,2019-08-23 10:20:15+00:00,british lamb is a billion pound industry and of its exports go to the eu its just one of many british industries under severe threat from a no deal brexit ,jeremycorbyn
1032,2019-08-22 16:32:44+00:00,sheep farming in cumbria isnt just a job its a tradition passed from generation to generation we will do everything we can to stop the tories pointless no deal brexit damaging it ,jeremycorbyn
1034,2019-08-21 16:22:18+00:00,the chaos of boris johnson s no deal brexit is real and threatening as the leaked operation yellowhammer dossier makes crystal clear ive invited party leaders and senior backbenchers from across parliament to meet to discuss all tactics available to prevent no deal ,jeremycorbyn
1041,2019-08-19 13:53:57+00:00,a general election triggered by the tory brexit crisis puts our country at a crossroads a once in a generation chance for a real change of direction ,jeremycorbyn
1061,2019-08-15 09:23:43+00:00,ive written to the leaders of other political parties and senior backbenchers from across parliament to lay out my plan to stop a disastrous no deal brexit and let the people decide the future of our country ,jeremycorbyn
1090,2019-08-06 08:06:24+00:00,boris johnson and his billionaire friends wont be affected by rising food prices in a no deal brexit ,jeremycorbyn
1099,2019-08-03 12:36:09+00:00,boris johnson and his millionaire friends wont be affected by rising food prices in a no deal brexit ,jeremycorbyn
1103,2019-08-02 13:31:04+00:00,im in scarborough talking with people about how a no deal brexit will increase food bills by  in threatening the country with a totally avoidable no deal brexit boris johnson is gambling with peoples lives ,jeremycorbyn
1119,2019-07-29 10:49:52+00:00,disgraceful for the government to spend m on advertising for a totally avoidable no deal brexit while four million people are in deep poverty boris johnson knows no deal will cost jobs but the tories only care about the wealthy elite who fund them ,jeremycorbyn
1137,2019-07-25 19:59:06+00:00,labour has a plan for our country we ll back a public vote on any brexit deal or no deal give the nhs the funding it needs introduce a real living wage of an hour kickstart a green industrial revolution reduce class sizes and give pensioners the dignity they deserve ,jeremycorbyn
1138,2019-07-25 19:29:44+00:00,boris johnson showed us today that he s got no plan on brexit no plan to rebuild our public services and no plan to tackle the climate emergency hes spent his leadership campaign promising tax giveaways to the richest hell work for the few well work for the many ,jeremycorbyn
1139,2019-07-25 18:50:54+00:00,boris johnson wasn t chosen by you he was chosen by fewer than  unrepresentative tory party members you deserve your say whether that s in a public vote on brexit or in a general election so that everyone has the chance to decide the future of our country ,jeremycorbyn
1153,2019-07-23 11:13:46+00:00,johnson s no deal brexit would mean job cuts higher prices in the shops and risk our nhs being sold off to us corporations in a sweetheart deal with donald trump the people of our country should decide who becomes the prime minister in a general election ,jeremycorbyn
1154,2019-07-23 11:13:45+00:00,boris johnson has won the support of fewer than  unrepresentative conservative party members by promising tax cuts for the richest presenting himself as the bankers friend and pushing for a damaging no deal brexit but he hasnt won the support of our country ,jeremycorbyn
1174,2019-07-18 15:31:55+00:00,important victory in the commons today to prevent the tories from suspending parliament to force through a disastrous no deal labour will do everything we can to prevent the next prime minister dragging us towards a no deal brexit ,jeremycorbyn
1228,2019-07-03 13:20:42+00:00,boris johnson and jeremy hunt are threatening a no deal brexit that would put jobs and our economy at risk ,jeremycorbyn
1316,2019-06-10 15:19:23+00:00,today we welcomed labours newest mp the people of peterborough rejected the tories the brexit party and austerity showing support for labours plan to end cuts and invest in services and communities ,jeremycorbyn
1331,2019-06-07 01:17:59+00:00,this result shows that despite the divisions and deadlock over brexit when it comes to a vote on the issues that directly affect people s lives labour s case for real change has strong support across the country i look forward to welcoming lisa to parliament next week ,jeremycorbyn
1359,2019-05-30 18:45:13+00:00,on my visit to ireland its clear we cannot have a no deal brexit ,jeremycorbyn
1405,2019-05-21 17:49:18+00:00,theresa mays new brexit deal is a rehash of her old bad deal and labour cannot support it ,jeremycorbyn
1600,2019-04-11 14:55:49+00:00,some conservatives want nothing more than to use brexit to create a race to the bottom ,jeremycorbyn
1641,2019-03-29 17:11:53+00:00,today theresa mays botched brexit deal was defeated again the deal is bad for our democracy bad for our economy and bad for this country heres my full speech ,jeremycorbyn
1643,2019-03-29 13:33:47+00:00,this afternoon the prime minister is asking mps to vote for a blind brexit this young womans words are as true today as they were last week ,jeremycorbyn
1647,2019-03-27 18:35:41+00:00,theresa may s pledge to tory mps to stand down if they vote for her deal shows once and for all that her chaotic brexit negotiations have been about party management not principles or the public interest a change of government cant be a tory stitch up the people must decide ,jeremycorbyn
1649,2019-03-27 13:50:24+00:00,the prime minister is failing to deliver brexit because she cant build a consensus is unable to compromise and unable to reunite the country ,jeremycorbyn
1670,2019-03-21 17:43:04+00:00,workers and businesses are rightly calling for theresa may to change her approach to brexit labours alternative plan would protect jobs the economy and living standards it could win the support of parliament and the eu and bring the country together ,jeremycorbyn
1671,2019-03-21 17:23:35+00:00,today i met party leaders and prime ministers from across europe i laid out our alternative plan for brexit that would secure a close economic relationship between the uk and the eu ,jeremycorbyn
1702,2019-03-12 17:06:07+00:00,parliament owes it to the people of this country to reject theresa mays botched brexit deal ,jeremycorbyn
1704,2019-03-12 07:17:37+00:00,since her brexit deal was so overwhelmingly rejected the prime minister has recklessly run down the clock failed to effectively negotiate with the eu and refused to find common ground for a deal parliament could support that s why mps must reject this deal today ,jeremycorbyn
1707,2019-03-11 13:27:13+00:00,the prime minister cannot keep dodging scrutiny after failing to get changes to her overwhelmingly rejected deal theresa may must come to parliament this afternoon and face up to the mess her government has made of the brexit negotiations ,jeremycorbyn
1723,2019-03-07 13:37:33+00:00,my determination is to prevent a no deal or damaging tory brexit ,jeremycorbyn
1725,2019-03-07 09:08:58+00:00,were stuck in the mess the government has made of brexit it is dragging our communities down whether they voted leave or remain and driving deep division my article in the ,jeremycorbyn
1733,2019-03-04 19:05:16+00:00,the governments brexit policy is failing businesses so badly that workers are petitioning their employers to stay in the uk hondas decision to close its factory in swindon is a huge blow to thousands of workers and the whole community ,jeremycorbyn
1746,2019-02-27 21:39:40+00:00,after tonights votes in parliament well continue to push for a close economic relationship based on our credible alternative plan or a general election well also back a public vote in order to prevent a damaging tory brexit or disastrous no deal ,jeremycorbyn
1754,2019-02-25 19:51:47+00:00,tomorrow labour will table an amendment to make labours credible alternative plan the uk s brexit negotiating position ,jeremycorbyn
1755,2019-02-25 10:51:08+00:00,after meetings in brussels and madrid it s clear that labours alternative plan for brexit is credible and could be negotiated with the eu ,jeremycorbyn
1763,2019-02-22 21:33:27+00:00,an informative and optimistic discussion with spains prime minister pedro s nchez we talked about next weeks brexit votes in the uk parliament and labours alternative plan as well as the upcoming spanish elections and how we work together to combat the far right ,jeremycorbyn
1768,2019-02-21 17:47:18+00:00,labours alternative brexit plan could break the deadlock command the support of parliament and bring our country together after meetings today in brussels it s clear that our alternative is credible and could be negotiated with the eu ,jeremycorbyn
1777,2019-02-18 19:45:08+00:00,hondas decision to close its factory in swindon is a huge blow to the thousands of workers and the whole community the governments disastrous handling of brexit is letting people down across the country ,jeremycorbyn
1778,2019-02-18 10:49:35+00:00,the tories are bungling brexit while labour has set out a unifying and credible alternative plan when millions face the misery of universal credit rising crime homelessness and poverty now more than ever is the time to bring people together to build a better future for us all,jeremycorbyn
1790,2019-02-14 19:56:32+00:00,yet again theresa mays brexit deal has been defeated ,jeremycorbyn
1791,2019-02-14 19:03:00+00:00,tonight s vote showed there is no majority for the prime ministers brexit plan she needs to admit her strategy has failed shift her red lines and come back with a proposal that can truly command support in parliament ,jeremycorbyn
1819,2019-02-06 23:13:26+00:00,last week theresa may and i met to discuss how the brexit deadlock can be broken after her botched deal was rejected by mps today i have written to outline labours five demands for a sensible agreement that can win the support of parliament and bring the country together ,jeremycorbyn
1827,2019-02-03 13:28:55+00:00,the conservatives botched negotiations and threat of a no deal brexit is causing uncertainty and damaging britains economy ,jeremycorbyn
1841,2019-01-29 17:15:57+00:00,this governments shambolic handling of brexit negotiations is fast becoming a crisis ,jeremycorbyn
1854,2019-01-22 18:18:17+00:00,having botched brexit and created a deadlock in parliament its shocking that a third of the cabinet have the audacity to run off to sip champagne with the worlds elite ,jeremycorbyn
1864,2019-01-18 20:38:43+00:00,my response to theresa may who is still refusing to take no deal off the table to help break the brexit deadlock ,jeremycorbyn
1869,2019-01-17 13:33:00+00:00,the starting point for any talks to break the brexit deadlock must be to rule out a disastrous no deal outcome my letter to theresa may ,jeremycorbyn
1870,2019-01-17 12:15:38+00:00, take a no deal brexit off the table ,jeremycorbyn
1872,2019-01-16 20:51:50+00:00,now that theresa mays botched deal has been decisively rejected the starting point for talks to break the brexit deadlock must be that no deal is taken off the table ,jeremycorbyn
1895,2019-01-10 12:37:00+00:00,to break the deadlock over theresa mays botched brexit deal a general election is the most practical and democratic option it would give the winning party a renewed mandate to negotiate a better deal for britain and secure support for it in parliament and across the country ,jeremycorbyn
1900,2019-01-08 19:04:37+00:00,this vote is an important step to prevent a no deal brexit it shows that there is no majority in parliament the cabinet or the country for crashing out of the eu without an agreement ,jeremycorbyn
1902,2019-01-08 18:52:16+00:00,today the government has admitted that nothing has changed to its botched brexit deal theresa may has recklessly run down the clock and secured no legal or other changes to the withdrawal agreement ,jeremycorbyn
1905,2019-01-07 14:38:08+00:00,theresa may must come to parliament to answer questions on her botched brexit deal the public has a right to know what if anything has changed since she dodged the meaningful vote nearly one month ago and we need a guarantee that the vote will not be delayed again ,jeremycorbyn
1930,2018-12-28 12:28:39+00:00,the prime minister should recall parliament and bring forward the chance for mps to vote on her botched brexit deal by cynically running down the clock theresa may is trying to create a false choice between her deal and no deal ,jeremycorbyn
1953,2018-12-17 17:17:04+00:00,today the tories have been dragged kicking and screaming to announce a date to vote on theresa mays botched brexit deal ,jeremycorbyn
1958,2018-12-15 09:27:15+00:00,while the government is locked in chaos over its botched brexit negotiations the nhs is being neglected ,jeremycorbyn
1961,2018-12-14 15:12:30+00:00,the last hours have shown that theresa may s brexit deal is dead in the water shes failed to deliver any meaningful changes rather than ploughing ahead and recklessly running down the clock she needs to put her deal to a vote next week so parliament can take back control,jeremycorbyn
1964,2018-12-13 20:37:58+00:00,its clear after theresa may went back to brussels today that therell be no changes to her botched brexit deal there must be no more delays or attempts to run down the clock to deny parliament alternative options theres no time to waste and parliament must take back control,jeremycorbyn
1965,2018-12-12 21:23:56+00:00,tonights vote changes nothing theresa may has lost her majority in parliament her government is in chaos and shes unable to deliver a brexit deal that works for the country and puts jobs and the economy first she must now bring her botched deal back to parliament next week,jeremycorbyn
1969,2018-12-11 20:51:21+00:00,tonight we should be voting on theresa may s botched brexit deal but to avoid a resounding defeat she pulled the vote at the very last minute ,jeremycorbyn
1970,2018-12-11 17:42:31+00:00,in years as an mp ive never witnessed such an abject mess as this prime minister has made of these brexit negotiations ,jeremycorbyn
1974,2018-12-10 12:48:16+00:00,the government has decided theresa mays brexit deal is so disastrous that it has taken the desperate step of delaying its own vote at the eleventh hour ,jeremycorbyn
1979,2018-12-08 17:09:28+00:00,ahead of tuesdays brexit vote i travelled to lisbon to meet members of the party of european socialists labour is ready to step in and negotiate a deal that can work for our whole country ,jeremycorbyn
1980,2018-12-08 08:43:48+00:00,make no mistake labour is ready to step in and negotiate a brexit deal that works for the whole of our country ,jeremycorbyn
1988,2018-12-06 20:26:44+00:00,theresa mays botched brexit deal is the worst of all worlds it works for nobody whether they voted leave or remain thats why labour will vote against it on tuesday my article ,jeremycorbyn
1995,2018-12-04 20:27:21+00:00,our country deserves better than the tories botched brexit deal one week today labour will vote against it ,jeremycorbyn
2000,2018-12-03 18:06:12+00:00,workers rights are under threat from the tories botched brexit deal ,jeremycorbyn
2002,2018-12-02 19:13:15+00:00,great meetings with latin american and european leaders during s inauguration discussing trade brexit climate justice and how to defeat the far right and show how radical progressive politics can improve the lives of millions,jeremycorbyn
2006,2018-12-01 15:55:36+00:00, said she wanted a head to head debate with me on her botched brexit deal and i am ready to do that have a straightforward plan if she and her team prefer she should join me in asking them to arrange an actual head to head debate ,jeremycorbyn
2043,2018-11-18 22:15:33+00:00,theresa may has finally managed to unite the country on brexit by bringing back a deal from brussels which everyone dislikes my article in the ,jeremycorbyn
2048,2018-11-15 13:40:32+00:00,theresa may should withdraw her half baked brexit deal that doesnt even have the support of her own cabinet ,jeremycorbyn
2051,2018-11-13 21:24:26+00:00,parliament is sovereign and must have a truly meaningful vote on any brexit agreement we demand that parliament is able to amend and propose alternatives to whatever deal the government brings forward ,jeremycorbyn
2116,2018-10-20 19:08:11+00:00,today in geneva i spoke to un commissioner about workers rights and human rights the tories want to use brexit for a race to the bottom in standards labour will transform a failed system to deliver better jobs and rights for uk workers and communities ,jeremycorbyn
2139,2018-10-16 08:19:11+00:00,if the government cannot get a good brexit deal for this country then it should make way for those who can ,jeremycorbyn
2189,2018-09-30 07:31:36+00:00,let me repeat my offer to the prime minister on her brexit deal ,jeremycorbyn
2199,2018-09-27 19:19:39+00:00,useful meeting today in brussels with eu chief brexit negotiator i set out labour s brexit priorities our six tests for any deal and the need to avoid a no deal outcome which would be deeply damaging to jobs and living standards in britain and across the eu ,jeremycorbyn
2227,2018-09-25 10:08:10+00:00,watch live at labour party conference as he outlines our alternative to the tories chaotic and shambolic brexit ,jeremycorbyn
2261,2018-09-21 15:49:09+00:00,the prime minister s brexit negotiating strategy has been a disaster from day one has looked incapable of delivering a good deal for britain the political games from both the eu and our government need to end because no deal is not an option ,jeremycorbyn
2309,2018-09-05 14:46:35+00:00,we need a real plan for brexit ,jeremycorbyn
2437,2018-07-10 20:29:54+00:00,it speaks volumes that this is who has chosen to lead her tory brexit ,jeremycorbyn
2442,2018-07-08 23:38:19+00:00,david davis resigning at such a crucial time shows has no authority left and is incapable of delivering brexit with her government in chaos if she clings on its clear shes more interested in hanging on for her own sake than serving the people of our country ,jeremycorbyn
2453,2018-07-05 15:46:32+00:00,good to meet the dutch prime minister mark rutte in the hague today we discussed brexit a uk eu trade deal and how to protect our steel industries as well as the conflicts driving the devastating refugee crisis around europe ,jeremycorbyn
